{
  "id": "01a13cdb-cc03-7433-bee6-fababed9f2a8",
  "name": "Cotton jersey (placeholder)",
  "category": "knit",
  "density": 0.15,
  "stretch": {
    "warp": 11547.005383792517,
    "weft": 11547.005383792517,
    "shear": 4330.127018922194
  },
  "bending": {
    "warp": 5e-6,
    "weft": 5e-6
  },
  "friction": 0.3,
  "notes": "The engine's spike-1 placeholder (Material::cotton), not calibrated. Stretch from the per-edge stiffness 1e4 N/m: Y = 2k/sqrt(3), shear = 3Y/8 (triangle lattice, Poisson 1/3)."
}
